{"schema":"sipi.capabilities-baseline.v1","status":"baseline_nonpublic","runtime_consumable":false,"advertise":false,"default_auto_eligible":false,"source":{"path":"docs/baselines/capability-inventory.yaml","schema":"sipi.capability-inventory.m0.v1","sha256":"AAAAAAAAAAAAAAAAAAAAAAAAAAAAAAAAAAAAAAAAAAAAAAAAAAAAAAAAAAAAAAAA","converter_version":"fixture","observed_metadata":{}},"capability_key_fields":["operation","payload_schema","engine_instance","behavior_profile","platform.os","platform.architecture","execution_mode"],"catalogs":{"sources":[],"environments":[],"legacy_artifacts":[],"instances":[]},"capabilities":[{"source_inventory_id":"fixture-1","key":{"operation":"link.simulate.v1","payload_schema":"pybert.simulation.v1","engine_instance":"pybert-python","behavior_profile":"fixture","platform":{"os":"windows","architecture":"x86_64","source_literal":"windows-x86_64"},"execution_mode":"in_process"},"role":"reference","implementation_state":"partial","evidence_state":"blocked","release_channel":"internal","enforcement_state":"unverified","fixtures":{"required":[],"optional":[]},"evidence_refs":["fixture"],"blockers":[]}],"unmapped_capability_gaps":[],"non_claims":["fixture"]}
